{
  "document": {
    "paper": "a4",
    "title": "実験レポート",
    "author": ""
  },
  "page": {
    "margin": {
      "top": "25mm",
      "bottom": "25mm",
      "left": "25mm",
      "right": "25mm"
    },
    "numbering": true
  },
  "text": {
    "font_size": "10.5pt",
    "line_spacing": 1.5,
    "paragraph_indent": 0
  },
  "font": {
    "main": "IPAexMincho",
    "mono": "Noto Sans Mono CJK JP"
  }
}